While I Can, WhileICan.mp3
Highway to Hell, AC_DC - Highway to Hell (Official Video).mp3
Into You, Ariana Grande - Into You (Official Audio).mp3
Wake Me Up, Avicii - Wake Me Up (Official Video).mp3
Break from Toronto, Break from Toronto.mp3
We Don't Talk Anymore (feat. Selena Gomez), Charlie Puth - We Don't Talk Anymore (feat. Selena Gomez) [Official Video].mp3
No Guidance (feat. Drake), Chris Brown - No Guidance (Audio) ft. Drake.mp3
Creepin, Creepin.mp3
Everlong, Foo Fighters - Everlong (Official HD Video).mp3
Sweet Child O' Mine, Foo Fighters - Everlong (Official HD Video).mp3
Heartless, Heartless.mp3
Work Out, J. Cole - Work Out (Audio).mp3
Low Down, Lil Baby - Low Down (Music Video).mp3
Poison, Poison.mp3
I Wanna Be Sedated, Ramones - I Wanna Be Sedated (Official Music Video).mp3
Closer, The Chainsmokers - Closer (Official Video) ft. Halsey.mp3
YOSEMITE, Travis Scott - YOSEMITE (Audio).mp3